{
  "censored": [],
  "cgroup_memory_peak": {
    "available": true,
    "bytes": 1966964736,
    "cgroup_path": "/user.slice/user-1000.slice/user@1000.service/app.slice/acacia-s0-load_balancer_unreal2-n6.scope",
    "sample_point": "campaign-finalization-before-process-exit",
    "source": "/sys/fs/cgroup/user.slice/user-1000.slice/user@1000.service/app.slice/acacia-s0-load_balancer_unreal2-n6.scope/memory.peak"
  },
  "counters": {},
  "diagnostic_errors": [],
  "elapsed_s": 5.209835461981129,
  "environment": {
    "binaries": {
      "tlsfcertcheck": {
        "path": "/home/gperez/GIT-repos/acacia-bonsai/subprojects/tlsf-tools/build-L0/tlsfcertcheck",
        "sha256": "a7fffaa32b77cb5a13938ccfb02f7d93b6a31ec350d5f2da3e838a1574630d9d"
      },
      "tlsfsolve": {
        "path": "/home/gperez/GIT-repos/acacia-bonsai/subprojects/tlsf-tools/build-L0/tlsfsolve",
        "sha256": "afa00abda2afde0a157dd242c080125bcbc222929dcc08d346c088c9c8812bde"
      }
    },
    "bindings_python": "/usr/bin/python3.13",
    "bindings_site": "/usr/local/lib64/python3.13/site-packages",
    "interpreter": {
      "executable": "/home/gperez/GIT-repos/acacia-bonsai/.venv/bin/python",
      "version": "3.14.7 (main, Aug 10 2026, 00:00:00) [GCC 16.1.1 20260515 (Red Hat 16.1.1-2)]"
    },
    "tlsf_tools_build": "/home/gperez/GIT-repos/acacia-bonsai/subprojects/tlsf-tools/build-L0"
  },
  "generalizer": {
    "bdd_stats": {
      "available": false,
      "samples": []
    },
    "censored": [],
    "checker_mode_attempts": [
      {
        "label": "target-6",
        "mode_count": 4,
        "node_cap": 67108864,
        "side": "environment"
      }
    ],
    "checker_stats": {
      "attempts": [
        {
          "certificate_side": "environment",
          "error": null,
          "label": "target-6",
          "mode_count": 4,
          "node_cap": 67108864,
          "returncode": 0,
          "stats": null
        }
      ],
      "mode": null,
      "supported": false
    },
    "counters": {},
    "diagnostic_errors": [],
    "distributions": {
      "client_count_histogram": {
        "6": 1
      },
      "distinct_subset_count": 0,
      "mode_count_basis": "actual_checker_attempts",
      "mode_count_histogram": {
        "4": 1
      },
      "ownership_tuple_arity_histogram": {
        "0": 12,
        "1": 46,
        "2": 70
      },
      "projected_root_support_widths": [],
      "selected_aig_cones": [],
      "subset_reuse": [],
      "uint64_variable_mask_word_length_histogram": {}
    },
    "elapsed_s": 5.050430984993,
    "environment": {
      "binaries": {
        "tlsfcertcheck": {
          "path": "/home/gperez/GIT-repos/acacia-bonsai/subprojects/tlsf-tools/build-L0/tlsfcertcheck",
          "sha256": "a7fffaa32b77cb5a13938ccfb02f7d93b6a31ec350d5f2da3e838a1574630d9d"
        },
        "tlsfsolve": {
          "path": "/home/gperez/GIT-repos/acacia-bonsai/subprojects/tlsf-tools/build-L0/tlsfsolve",
          "sha256": "afa00abda2afde0a157dd242c080125bcbc222929dcc08d346c088c9c8812bde"
        }
      },
      "binding_module_candidates": [
        "/usr/local/lib64/python3.13/site-packages/buddy.py"
      ],
      "bindings_site": "/usr/local/lib64/python3.13/site-packages",
      "extension_module_candidates": [
        "/usr/local/lib64/python3.13/site-packages/_buddy.cpython-313-x86_64-linux-gnu.so"
      ],
      "interpreter": {
        "executable": "/usr/bin/python3.13",
        "version": "3.13.15 (main, Aug 10 2026, 00:00:00) [GCC 16.1.1 20260515 (Red Hat 16.1.1-2)]"
      },
      "tlsf_tools_build": "/home/gperez/GIT-repos/acacia-bonsai/subprojects/tlsf-tools/build-L0"
    },
    "instances": [
      {
        "clients": 6,
        "family": "load_balancer_unreal2",
        "game": "/home/gperez/GIT-repos/acacia-gr1-par2-timing/benchmarking/gr1-par2-20260923/s0/raw/runs/load_balancer_unreal2-n6/load_balancer_unreal2-n6-797337f2600c-imizmuxh/generalizer/load_balancer_unreal2_6.game.aag",
        "role": "target"
      }
    ],
    "outcome": {
      "answer": "UNREALIZABLE",
      "family": "load_balancer_unreal2",
      "reason": "",
      "target": 6,
      "verdict": "VERIFIED"
    },
    "phases": {
      "bdd_projection_relabel": {
        "calls": 0,
        "wall_s": 0.0
      },
      "export": {
        "calls": 0,
        "wall_s": 0.0
      },
      "from_aag": {
        "calls": 0,
        "wall_s": 0.0
      },
      "instantiate_templates": {
        "calls": 0,
        "wall_s": 0.0
      },
      "mode_specialization": {
        "calls": 0,
        "wall_s": 0.0
      },
      "policy_construction_skolemization": {
        "calls": 0,
        "wall_s": 0.0
      },
      "projection_metadata": {
        "calls": 0,
        "wall_s": 0.0
      },
      "seed_monitor_construction": {
        "calls": 0,
        "wall_s": 0.0
      },
      "seed_solves": {
        "calls": 0,
        "wall_s": 0.0
      },
      "substitute_variables": {
        "calls": 0,
        "wall_s": 0.0
      },
      "support_extraction": {
        "calls": 0,
        "wall_s": 0.0
      },
      "target_check": {
        "calls": 1,
        "wall_s": 3.4934599129483104
      },
      "target_monitor_construction": {
        "calls": 1,
        "wall_s": 0.08396119502140209
      },
      "target_solve": {
        "calls": 1,
        "wall_s": 1.4478817379567772
      },
      "variable_cube_construction": {
        "calls": 0,
        "wall_s": 0.0
      }
    },
    "schema": "acacia-gr1-s0-diagnostics-v1",
    "schema_version": 1,
    "status": "completed",
    "tool": "generalize_gr1"
  },
  "outcome": {
    "certificate": "/home/gperez/GIT-repos/acacia-gr1-par2-timing/benchmarking/gr1-par2-20260923/s0/raw/runs/load_balancer_unreal2-n6/load_balancer_unreal2-n6-797337f2600c-imizmuxh/generalizer/load_balancer_unreal2_6.certificate.aag",
    "policy": "/home/gperez/GIT-repos/acacia-gr1-par2-timing/benchmarking/gr1-par2-20260923/s0/raw/runs/load_balancer_unreal2-n6/load_balancer_unreal2-n6-797337f2600c-imizmuxh/generalizer/load_balancer_unreal2_6.policy.aag",
    "reason": "target_verified",
    "stage": "target_check",
    "stdout_line": "UNREALIZABLE /home/gperez/GIT-repos/acacia-gr1-par2-timing/benchmarking/gr1-par2-20260923/s0/raw/runs/load_balancer_unreal2-n6/load_balancer_unreal2-n6-797337f2600c-imizmuxh/generalizer/load_balancer_unreal2_6.certificate.aag",
    "verdict": "UNREALIZABLE"
  },
  "phases": {
    "generalize_gr1": {
      "calls": 1,
      "wall_s": 5.183971974009182
    }
  },
  "schema": "acacia-gr1-s0-diagnostics-v1",
  "schema_version": 1,
  "status": "completed",
  "tool": "param-lift-campaign"
}
