{
  "censored": [],
  "cgroup_memory_peak": {
    "available": true,
    "bytes": 1703055360,
    "cgroup_path": "/user.slice/user-1000.slice/user@1000.service/app.slice/acacia-s0-load_balancer_unreal2-n7.scope",
    "sample_point": "campaign-finalization-before-process-exit",
    "source": "/sys/fs/cgroup/user.slice/user-1000.slice/user@1000.service/app.slice/acacia-s0-load_balancer_unreal2-n7.scope/memory.peak"
  },
  "counters": {},
  "diagnostic_errors": [],
  "elapsed_s": 11.088938108005095,
  "environment": {
    "binaries": {
      "tlsfcertcheck": {
        "path": "/home/gperez/GIT-repos/tlsf-tools/build-P5-9212e2b/tlsfcertcheck",
        "sha256": "65fd3dd9fc9ad3c1a203662fa4c4def3cce68fce5504f6033dd850077d416f84"
      },
      "tlsfsolve": {
        "path": "/home/gperez/GIT-repos/tlsf-tools/build-P5-9212e2b/tlsfsolve",
        "sha256": "80892fef82fc5a1297c785e5a16c52e88ed849fa13f5cdbcf5ec30bc1f4d210e"
      }
    },
    "bindings_python": "/usr/bin/python3.13",
    "bindings_site": "/usr/local/lib64/python3.13/site-packages",
    "buddy_adapter": "/home/gperez/GIT-repos/acacia-gr1-par2-timing/build_gr1par2-adapter-ba98fb39/libbuddy_veccompose_adapter.so",
    "compose_route": "native_veccompose",
    "interpreter": {
      "executable": "/home/gperez/GIT-repos/acacia-bonsai/.venv/bin/python",
      "version": "3.14.7 (main, Aug 10 2026, 00:00:00) [GCC 16.1.1 20260515 (Red Hat 16.1.1-2)]"
    },
    "tlsf_tools_build": "/home/gperez/GIT-repos/tlsf-tools/build-P5-9212e2b"
  },
  "generalizer": {
    "bdd_stats": {
      "available": false,
      "samples": []
    },
    "censored": [],
    "checker_mode_attempts": [
      {
        "label": "target-7",
        "mode_count": 4,
        "node_cap": 67108864,
        "side": "environment"
      }
    ],
    "checker_stats": {
      "attempts": [
        {
          "certificate_side": "environment",
          "error": null,
          "label": "target-7",
          "mode_count": 4,
          "node_cap": 67108864,
          "returncode": 0,
          "stats": {
            "aig_gates_visited": 15334,
            "cache_cap": 67108864,
            "final_status": "VERIFIED",
            "node_cap": 67108864,
            "peak_live_nodes_sample": 3670017,
            "policy_counter_constants": 12,
            "policy_cross_mode_root_reuses": 8,
            "policy_dependent_gates_per_mode": 41,
            "policy_full_cache_modes": 0,
            "policy_independent_gates": 20,
            "policy_independent_roots": 2,
            "policy_mode_builds": 4,
            "policy_specialized_gates": 164,
            "policy_unspecialized_gates": 0,
            "proof_seconds": 0.997313325,
            "requested_roots": 1494,
            "setup_seconds": 0.1864053,
            "successor_applications": 2752,
            "successor_substitutions": 4
          }
        }
      ],
      "mode": "stream",
      "supported": true
    },
    "counters": {},
    "diagnostic_errors": [],
    "distributions": {
      "client_count_histogram": {
        "7": 1
      },
      "distinct_subset_count": 0,
      "mode_count_basis": "actual_checker_attempts",
      "mode_count_histogram": {
        "4": 1
      },
      "ownership_tuple_arity_histogram": {
        "0": 12,
        "1": 53,
        "2": 96
      },
      "projected_root_support_widths": [],
      "selected_aig_cones": [],
      "subset_reuse": [],
      "uint64_variable_mask_word_length_histogram": {}
    },
    "elapsed_s": 10.881547208991833,
    "environment": {
      "binaries": {
        "tlsfcertcheck": {
          "path": "/home/gperez/GIT-repos/tlsf-tools/build-P5-9212e2b/tlsfcertcheck",
          "sha256": "65fd3dd9fc9ad3c1a203662fa4c4def3cce68fce5504f6033dd850077d416f84"
        },
        "tlsfsolve": {
          "path": "/home/gperez/GIT-repos/tlsf-tools/build-P5-9212e2b/tlsfsolve",
          "sha256": "80892fef82fc5a1297c785e5a16c52e88ed849fa13f5cdbcf5ec30bc1f4d210e"
        }
      },
      "binding_module_candidates": [
        "/usr/local/lib64/python3.13/site-packages/buddy.py"
      ],
      "bindings_site": "/usr/local/lib64/python3.13/site-packages",
      "buddy_adapter": "/home/gperez/GIT-repos/acacia-gr1-par2-timing/build_gr1par2-adapter-ba98fb39/libbuddy_veccompose_adapter.so",
      "compose_route": "native_veccompose",
      "extension_module_candidates": [
        "/usr/local/lib64/python3.13/site-packages/_buddy.cpython-313-x86_64-linux-gnu.so"
      ],
      "interpreter": {
        "executable": "/usr/bin/python3.13",
        "version": "3.13.15 (main, Aug 10 2026, 00:00:00) [GCC 16.1.1 20260515 (Red Hat 16.1.1-2)]"
      },
      "tlsf_tools_build": "/home/gperez/GIT-repos/tlsf-tools/build-P5-9212e2b"
    },
    "instances": [
      {
        "clients": 7,
        "family": "load_balancer_unreal2",
        "game": "/home/gperez/GIT-repos/acacia-gr1-par2-timing/benchmarking/gr1-par2-20260923/s0/raw-p5-policy/runs/load_balancer_unreal2-n7/load_balancer_unreal2-n7-aa5c259d4418-5bg0a860/generalizer/load_balancer_unreal2_7.game.aag",
        "role": "target"
      }
    ],
    "outcome": {
      "answer": "UNREALIZABLE",
      "family": "load_balancer_unreal2",
      "reason": "",
      "target": 7,
      "verdict": "VERIFIED"
    },
    "phases": {
      "bdd_projection_relabel": {
        "calls": 0,
        "wall_s": 0.0
      },
      "export": {
        "calls": 0,
        "wall_s": 0.0
      },
      "from_aag": {
        "calls": 0,
        "wall_s": 0.0
      },
      "instantiate_templates": {
        "calls": 0,
        "wall_s": 0.0
      },
      "mode_specialization": {
        "calls": 0,
        "wall_s": 0.0
      },
      "policy_construction_skolemization": {
        "calls": 0,
        "wall_s": 0.0
      },
      "projection_metadata": {
        "calls": 0,
        "wall_s": 0.0
      },
      "seed_monitor_construction": {
        "calls": 0,
        "wall_s": 0.0
      },
      "seed_solves": {
        "calls": 0,
        "wall_s": 0.0
      },
      "substitute_variables": {
        "calls": 0,
        "wall_s": 0.0
      },
      "support_extraction": {
        "calls": 0,
        "wall_s": 0.0
      },
      "target_check": {
        "calls": 1,
        "wall_s": 1.332564142998308
      },
      "target_monitor_construction": {
        "calls": 1,
        "wall_s": 0.09066990000428632
      },
      "target_solve": {
        "calls": 1,
        "wall_s": 9.434814009990077
      },
      "variable_cube_construction": {
        "calls": 0,
        "wall_s": 0.0
      }
    },
    "schema": "acacia-gr1-s0-diagnostics-v1",
    "schema_version": 1,
    "status": "completed",
    "tool": "generalize_gr1"
  },
  "outcome": {
    "certificate": "/home/gperez/GIT-repos/acacia-gr1-par2-timing/benchmarking/gr1-par2-20260923/s0/raw-p5-policy/runs/load_balancer_unreal2-n7/load_balancer_unreal2-n7-aa5c259d4418-5bg0a860/generalizer/load_balancer_unreal2_7.certificate.aag",
    "policy": "/home/gperez/GIT-repos/acacia-gr1-par2-timing/benchmarking/gr1-par2-20260923/s0/raw-p5-policy/runs/load_balancer_unreal2-n7/load_balancer_unreal2-n7-aa5c259d4418-5bg0a860/generalizer/load_balancer_unreal2_7.policy.aag",
    "proof_method": "policy",
    "reason": "target_verified",
    "stage": "target_check",
    "stdout_line": "UNREALIZABLE /home/gperez/GIT-repos/acacia-gr1-par2-timing/benchmarking/gr1-par2-20260923/s0/raw-p5-policy/runs/load_balancer_unreal2-n7/load_balancer_unreal2-n7-aa5c259d4418-5bg0a860/generalizer/load_balancer_unreal2_7.certificate.aag",
    "verdict": "UNREALIZABLE"
  },
  "phases": {
    "generalize_gr1": {
      "calls": 1,
      "wall_s": 11.050371124001686
    }
  },
  "schema": "acacia-gr1-s0-diagnostics-v1",
  "schema_version": 1,
  "status": "completed",
  "tool": "param-lift-campaign"
}
