{
  "censored": [],
  "cgroup_memory_peak": {
    "available": true,
    "bytes": 2665676800,
    "cgroup_path": "/user.slice/user-1000.slice/user@1000.service/app.slice/acacia-s0-round_robin_arbiter_unreal2-n7.scope",
    "sample_point": "campaign-finalization-before-process-exit",
    "source": "/sys/fs/cgroup/user.slice/user-1000.slice/user@1000.service/app.slice/acacia-s0-round_robin_arbiter_unreal2-n7.scope/memory.peak"
  },
  "counters": {},
  "diagnostic_errors": [],
  "elapsed_s": 31.20177127700299,
  "environment": {
    "binaries": {
      "tlsfcertcheck": {
        "path": "/home/gperez/GIT-repos/tlsf-tools/build-P14-dbe8c2b/tlsfcertcheck",
        "sha256": "2b2464a2f87537a0c7b159e11c134c23ce190da9345139b9e7b98455777437a6"
      },
      "tlsfsolve": {
        "path": "/home/gperez/GIT-repos/tlsf-tools/build-P14-dbe8c2b/tlsfsolve",
        "sha256": "512a05213eab72c4d5a0cf8e3c43ac43b6a9ce9bf8d7a0a89452be44bfe15502"
      }
    },
    "bindings_python": "/usr/bin/python3.13",
    "bindings_site": "/usr/local/lib64/python3.13/site-packages",
    "interpreter": {
      "executable": "/home/gperez/GIT-repos/acacia-bonsai/.venv/bin/python",
      "version": "3.14.7 (main, Aug 10 2026, 00:00:00) [GCC 16.1.1 20260515 (Red Hat 16.1.1-2)]"
    },
    "tlsf_tools_build": "/home/gperez/GIT-repos/tlsf-tools/build-P14-dbe8c2b"
  },
  "generalizer": {
    "bdd_stats": {
      "available": false,
      "samples": []
    },
    "censored": [],
    "checker_mode_attempts": [
      {
        "label": "target-7",
        "mode_count": 22,
        "node_cap": 67108864,
        "side": "environment"
      }
    ],
    "checker_stats": {
      "attempts": [
        {
          "certificate_side": "environment",
          "error": null,
          "label": "target-7",
          "mode_count": 22,
          "node_cap": 67108864,
          "returncode": 0,
          "stats": {
            "aig_gates_visited": 3646651,
            "final_status": "VERIFIED",
            "peak_live_nodes_sample": 6553601,
            "policy_counter_constants": 462,
            "policy_cross_mode_root_reuses": 4120,
            "policy_dependent_gates_per_mode": 3609146,
            "policy_full_cache_modes": 22,
            "policy_independent_gates": 4202,
            "policy_independent_roots": 4120,
            "policy_mode_builds": 22,
            "policy_specialized_gates": 0,
            "policy_unspecialized_gates": 3609146,
            "proof_seconds": 13.670556087,
            "requested_roots": 10210,
            "setup_seconds": 0.250204344,
            "successor_applications": 11832,
            "successor_substitutions": 22
          }
        }
      ],
      "mode": "stream",
      "supported": true
    },
    "counters": {},
    "diagnostic_errors": [],
    "distributions": {
      "client_count_histogram": {
        "7": 1
      },
      "distinct_subset_count": 0,
      "mode_count_basis": "actual_checker_attempts",
      "mode_count_histogram": {
        "22": 1
      },
      "ownership_tuple_arity_histogram": {
        "0": 2,
        "1": 84,
        "2": 84
      },
      "projected_root_support_widths": [],
      "selected_aig_cones": [],
      "subset_reuse": [],
      "uint64_variable_mask_word_length_histogram": {}
    },
    "elapsed_s": 31.046267733967397,
    "environment": {
      "binaries": {
        "tlsfcertcheck": {
          "path": "/home/gperez/GIT-repos/tlsf-tools/build-P14-dbe8c2b/tlsfcertcheck",
          "sha256": "2b2464a2f87537a0c7b159e11c134c23ce190da9345139b9e7b98455777437a6"
        },
        "tlsfsolve": {
          "path": "/home/gperez/GIT-repos/tlsf-tools/build-P14-dbe8c2b/tlsfsolve",
          "sha256": "512a05213eab72c4d5a0cf8e3c43ac43b6a9ce9bf8d7a0a89452be44bfe15502"
        }
      },
      "binding_module_candidates": [
        "/usr/local/lib64/python3.13/site-packages/buddy.py"
      ],
      "bindings_site": "/usr/local/lib64/python3.13/site-packages",
      "extension_module_candidates": [
        "/usr/local/lib64/python3.13/site-packages/_buddy.cpython-313-x86_64-linux-gnu.so"
      ],
      "interpreter": {
        "executable": "/usr/bin/python3.13",
        "version": "3.13.15 (main, Aug 10 2026, 00:00:00) [GCC 16.1.1 20260515 (Red Hat 16.1.1-2)]"
      },
      "tlsf_tools_build": "/home/gperez/GIT-repos/tlsf-tools/build-P14-dbe8c2b"
    },
    "instances": [
      {
        "clients": 7,
        "family": "round_robin_arbiter_unreal2",
        "game": "/home/gperez/GIT-repos/acacia-gr1-par2-timing/benchmarking/gr1-par2-20260923/s0/raw-p14/runs/round_robin_arbiter_unreal2-n7/round_robin_arbiter_unreal2-n7-e14c752708a9-q5y0wrui/generalizer/round_robin_arbiter_unreal2_7.game.aag",
        "role": "target"
      }
    ],
    "outcome": {
      "answer": "UNREALIZABLE",
      "family": "round_robin_arbiter_unreal2",
      "reason": "",
      "target": 7,
      "verdict": "VERIFIED"
    },
    "phases": {
      "bdd_projection_relabel": {
        "calls": 0,
        "wall_s": 0.0
      },
      "export": {
        "calls": 0,
        "wall_s": 0.0
      },
      "from_aag": {
        "calls": 0,
        "wall_s": 0.0
      },
      "instantiate_templates": {
        "calls": 0,
        "wall_s": 0.0
      },
      "mode_specialization": {
        "calls": 0,
        "wall_s": 0.0
      },
      "policy_construction_skolemization": {
        "calls": 0,
        "wall_s": 0.0
      },
      "projection_metadata": {
        "calls": 0,
        "wall_s": 0.0
      },
      "seed_monitor_construction": {
        "calls": 0,
        "wall_s": 0.0
      },
      "seed_solves": {
        "calls": 0,
        "wall_s": 0.0
      },
      "substitute_variables": {
        "calls": 0,
        "wall_s": 0.0
      },
      "support_extraction": {
        "calls": 0,
        "wall_s": 0.0
      },
      "target_check": {
        "calls": 1,
        "wall_s": 15.827581181947608
      },
      "target_monitor_construction": {
        "calls": 1,
        "wall_s": 0.0936619839631021
      },
      "target_solve": {
        "calls": 1,
        "wall_s": 15.099405831017066
      },
      "variable_cube_construction": {
        "calls": 0,
        "wall_s": 0.0
      }
    },
    "schema": "acacia-gr1-s0-diagnostics-v1",
    "schema_version": 1,
    "status": "completed",
    "tool": "generalize_gr1"
  },
  "outcome": {
    "certificate": "/home/gperez/GIT-repos/acacia-gr1-par2-timing/benchmarking/gr1-par2-20260923/s0/raw-p14/runs/round_robin_arbiter_unreal2-n7/round_robin_arbiter_unreal2-n7-e14c752708a9-q5y0wrui/generalizer/round_robin_arbiter_unreal2_7.certificate.aag",
    "policy": "/home/gperez/GIT-repos/acacia-gr1-par2-timing/benchmarking/gr1-par2-20260923/s0/raw-p14/runs/round_robin_arbiter_unreal2-n7/round_robin_arbiter_unreal2-n7-e14c752708a9-q5y0wrui/generalizer/round_robin_arbiter_unreal2_7.policy.aag",
    "reason": "target_verified",
    "stage": "target_check",
    "stdout_line": "UNREALIZABLE /home/gperez/GIT-repos/acacia-gr1-par2-timing/benchmarking/gr1-par2-20260923/s0/raw-p14/runs/round_robin_arbiter_unreal2-n7/round_robin_arbiter_unreal2-n7-e14c752708a9-q5y0wrui/generalizer/round_robin_arbiter_unreal2_7.certificate.aag",
    "verdict": "UNREALIZABLE"
  },
  "phases": {
    "generalize_gr1": {
      "calls": 1,
      "wall_s": 31.178312391974032
    }
  },
  "schema": "acacia-gr1-s0-diagnostics-v1",
  "schema_version": 1,
  "status": "completed",
  "tool": "param-lift-campaign"
}
